Domain,Unique Identifier,Name,Description,Last Change Date
Voltinism(VoltinismName),6,Bivoltine,Two generations per year,7/29/2014 12:00:00 AM
Voltinism(VoltinismName),4,Facultative Multivoltine,One or more generations per year,7/18/2008 11:58:24 AM
Voltinism(VoltinismName),2,Facultative Semivoltine,Life Cycle requires one year or more,7/18/2008 11:58:23 AM
Voltinism(VoltinismName),5,Multivoltine,More than one generation per year,7/18/2008 11:58:24 AM
Voltinism(VoltinismName),1,Semivoltine,Life Cycle requires more than one year,7/18/2008 11:58:22 AM
Voltinism(VoltinismName),3,Univoltine,One generation per year,7/18/2008 11:58:23 AM

